query;find_id;session_id;position;same_video
"small greyish fish lying on grey sand";91;6bCSh2bg;94;1
"small sea perch lying on grey sand";91;6bCSh2bg;66;1
"rounded fish with small prickles";97;6bCSh2bg;7843;0
"purcupinefish, greenish photo";97;6bCSh2bg;1660;0
"sea dragon looking like palm";105;6bCSh2bg;2;1
"a lot of striped black and white fishes and yellow fish";193;6bCSh2bg;188;0
"a lot of striped black and white butterflyfish and yellowtail fish in light blue water";193;6bCSh2bg;125;0
"diver face";317;6bCSh2bg;24;1
"a lot of banded butterflyfishes in light blue water";362;6bCSh2bg;137;1
"light blue photo of banded butterflyfishes and threespot damselfishes";362;6bCSh2bg;262;1
"light blue photo of black and white striped fishes and one black fish";426;6bCSh2bg;25;1
"brain coral in purplish photo";791;6bCSh2bg;8;1
"leaf coral in greenish photo";811;6bCSh2bg;91;1
"ivory bush coral in greenish photo";811;6bCSh2bg;23;1
"net lying on rocks in greenish photo";1337;6bCSh2bg;2;1
"bright yellow corals";1419;6bCSh2bg;38;1
"purplish bush coral on rocks";1623;6bCSh2bg;85;0
"small purplish bush coral on rocks";1623;6bCSh2bg;35;1
"whitish leaf coral";1851;6bCSh2bg;21;1
"purple ivory bush coral, whitish pillar coral and leaf coral";2235;6bCSh2bg;51;1
"bright blue tails on right side of photo, coral reef and whitish sand";2295;6bCSh2bg;1377;0
"bright blue fins on right side of the photo, coral reef and small spot of whitish sand";2295;6bCSh2bg;1121;0
"coral reef with brownish plant, bright blue water with small black fishes";2486;6bCSh2bg;3;1
"coral reef with diver and grey sand";2479;1DD5zvg_;676;0
"coral reef with a diver with a breathing bomb and grey sand";2479;1DD5zvg_;352;0
"brain coral and opening clam";2580;1DD5zvg_;1415;0
"brain coral and opening clam, giant barrel sponge, light blue photo";2580;1DD5zvg_;682;0
"small snake head in the middle of the photo surround with sand and grey corals";2685;1DD5zvg_;930;1
"small snake head in the middle of the photo surround with sand and grey corals, smooth mounding coral, bluebanded goby";2685;1DD5zvg_;166;1
"corals and small black fish";4646;1DD5zvg_;1371;0
"smooth mounding coral, threespot damselfish, nassau grouper";4646;1DD5zvg_;18;1
"poorly visible sharks";5541;1DD5zvg_;193;0
"poorly visible blue sharks in lighter blue water";5541;1DD5zvg_;38;1
"shark in darker blue water";5599;1DD5zvg_;316;1
"two blue shark in darker blue water";5599;1DD5zvg_;29;1
"two rays";8931;1DD5zvg_;526;0
"two spotted eagle ray above whitish sand";8931;1DD5zvg_;51;1
"brownish ivory bush coral";9828;1DD5zvg_;5132;0
"brownish ivory bush coral bottom of the sea, seagrass bed, bamboo coral";9828;1DD5zvg_;2614;1
"shipwreck";10759;1DD5zvg_;294;1
"shipwreck, windows and small tuna";10759;1DD5zvg_;10;1
"light brown corals and rocks on the left, darker blue water in the top left";13521;1DD5zvg_;9484;0
"light brown corals and rocks on the left, darker blue water in the top left, smooth mounding coral, pillar coral, hood coral, honeycomb coral, ivory bush coral";13521;1DD5zvg_;3591;0
"diver near big turtle";14198;1DD5zvg_;1900;0
"diver near turtle lying on sea floor and banded butterflyfish";14198;1DD5zvg_;163;0
"blackish parrot fish and brain coral";16545;1DD5zvg_;593;1
"grey parrotfish with white spots near small brain coral";16545;1DD5zvg_;122;1
"two sharks lying on sandy sea bed";17862;1DD5zvg_;333;1
"nurse shark, lemon shark, whitetip reef shark lying on whitish sand sea bed";17862;1DD5zvg_;36;1
"grey sand with long narrow fish";18806;1DD5zvg_;752;0
"sand with small trumpetfish";18806;1DD5zvg_;68;0
"diver with red fins";19929;1DD5zvg_;10774;0
"two divers with breathing bomb and red luminous divers fins, darker photo";19929;1DD5zvg_;11;1
"coral reef with small black bluetail fishes";2549;1DD5zvg_;4065;0
"pillar coral reef with small black fishes with blue tails";2549;1DD5zvg_;3640;0
"whitish sand with black sea cucumber";2585;1DD5zvg_;15;1
"brain coral and yellow and blue striped fish and yellow fish";2658;1DD5zvg_;2;1
"small shark under rock";2682;1DD5zvg_;3;1
"black ray";2742;1DD5zvg_;971;0
"black giant manta ray near rock";2742;1DD5zvg_;99;1
"parrot fish";2785;1DD5zvg_;21;1
"turtle near coral reef";2809;1DD5zvg_;33;1
"black and yellow striped fish next to coral reef";2819;1DD5zvg_;33;1
"pillar coral with two small black and blue fishes";2951;1DD5zvg_;53;1
"pillar coral with small yellow fish";3053;1DD5zvg_;1;1
"pillar coral with small yellow fish and diver in background";3415;1DD5zvg_;3119;0
"pillar coral with small yellow fish, sea anemone, bamboo coral, grooved brain coral, two divers in background";3415;1DD5zvg_;1030;1
"bright yellow fish in cave";3951;1DD5zvg_;130;0
"bright yellow fishes in cave, green moray eel";3951;1DD5zvg_;17;1
"bright blue moray eel opening mouth";4022;1DD5zvg_;1;1
"three divers, bright orange fins in blue photo";4314;1DD5zvg_;1138;0
"three divers with a lot of bubbles, orange fins in blue photo";4314;1DD5zvg_;103;0
"small black fishes swimming up near rock reef";4481;1DD5zvg_;18;1
"a lot of brownish fishes";4999;1DD5zvg_;167;1
"a lot of brownish striped mullet";4999;1DD5zvg_;15;1
"small brown and white creature with short tentacles near grey sand";5025;1DD5zvg_;653;0
"small brown and white creature with mandibles near grey sand";5025;1DD5zvg_;178;0
"orange weird fish";5104;1DD5zvg_;212;1
"oyster toadfish, scarlet frogfish, yellow tube sponge";5104;1DD5zvg_;23;1
"bright blue photo of white spotted shark";5282;1DD5zvg_;722;0
"bright light blue photo of white spotted whale shark";5282;1DD5zvg_;45;1
"moray eel eating lobster";5358;1DD5zvg_;160;0
"green moray eel eating lobster between whitish rocks, bigeye cardinalfish";5358;1DD5zvg_;34;1
"shark and four divers";5413;1DD5zvg_;310;0
"shark and four divers near white sand";5413;1DD5zvg_;148;1
"shark in spotlight";5432;1DD5zvg_;42;1
"diver swimming to the surface next to rock reef";5945;1DD5zvg_;8302;0
"diver swimming up to the bright surface between rocks";5945;1DD5zvg_;1869;0
"orange fishes under rock";6114;1DD5zvg_;2;1
"pillar reef with greenish and brownish corals";6134;1DD5zvg_;233;0
"pillar reef with greenish honeycomb corals and brownish pillar corals";6134;1DD5zvg_;221;0
"clown fish";6231;1DD5zvg_;2;1
"giant kelp";6257;1DD5zvg_;69;1
"giant kelp, bamboo coral";6257;1DD5zvg_;39;1
"yellowish coral with blueish ends";6295;1DD5zvg_;296;1
"moving yellowish coral with blueish ends, stanghorn coral, bamboo coral";6295;1DD5zvg_;211;1
"rocky reef with small black thorny creature";7346;1DD5zvg_;67;1
"rocky reef with two small black crown of thorns starfish";7346;1DD5zvg_;59;1
"three greyish rays lying in sand";8740;1DD5zvg_;4;1
"small brownish fish near rocky ocean bed in blue water";8812;1DD5zvg_;7669;0
"brownish fish above rocky ocean bed with greenish plant in blue water";8812;1DD5zvg_;1972;0
"two spotted rays";8912;1DD5zvg_;170;1
"two spotted eagle rays near ocean bed";8912;1DD5zvg_;27;1
"coral reef with brain corals, black thorn creatures under blue water";9104;1DD5zvg_;5322;0
"coral reef with brain corals, hood corals, whitish sand and small black thorn starfishes under blue water";9104;1DD5zvg_;5022;0
"coral reef with reddish corals";9233;1DD5zvg_;243;1
"coral reef with dark reddish corals, elkhorn coral, lophelia coral, devils hand coral";9233;1DD5zvg_;81;1
"fattish fish lying under rock";9368;1DD5zvg_;12;1
"spotted moray eel under coral reef";9487;1DD5zvg_;23;1
"blue and yellow fish near coral reef";9600;1DD5zvg_;10;1
"ivory bush coral bed with a lot of small fishes";9656;1DD5zvg_;293;0
"ocean bed full of small ivory bush corals with a lot of small fishes";9656;1DD5zvg_;1;1
"turtle near brown corals";9772;1DD5zvg_;734;0
"hawksbill turtle form behind near brown corals and rocks";9772;1DD5zvg_;516;1
"greenish brain coral and ivory bush coral on reddish rock with small fish";10123;1DD5zvg_;1871;0
"greenish brain coral and ivory bush coral on reddish rock with small fish, cockscomb cup coral, light purple corals";10123;1DD5zvg_;2946;0
"shipwreck with windows";10739;1DD5zvg_;162;1
"kind of inside shipwreck with windows";10739;1DD5zvg_;44;1
"white black spotted fish above white sandy ocean bed";11643;1DD5zvg_;144;0
"white black spotted porcupinefish above white sandy ocean bed";11643;1DD5zvg_;6;1
"striped white and brown fish above sand, brownish photo";12525;1DD5zvg_;23;1
"octopus lying in sand";12785;1DD5zvg_;14;1
"bush coral in spotlight";12829;1DD5zvg_;372;0
"giant barrel sponge in spotlight";12829;1DD5zvg_;1;1
"orange creature above greyish sand with pillar coral";12906;1DD5zvg_;1630;0
"orange and white creature above greyish sand";12906;1DD5zvg_;145;0
"hand holding round creature";13252;1DD5zvg_;97;1
"hand holding round creature, eccentric sand dollar";13252;1DD5zvg_;6;1
"orange clownfish";13333;1DD5zvg_;7;1
"sea star";13947;1DD5zvg_;10;1
"long narrow fish lying in white sand";14096;1DD5zvg_;18;1
"giant barrel sponge";14346;1DD5zvg_;2313;0
"part of giant barrel sponge looking to middle of it";14346;1DD5zvg_;996;1
"purple leafy corals from detail";14417;1DD5zvg_;89;0
"purple stanghorn corals from detail";14417;1DD5zvg_;57;1
"giant barrel sponge";15450;1DD5zvg_;22;1
"giant leaf corals with diver";16062;1DD5zvg_;286;0
"giant brain corals with diver";16062;1DD5zvg_;43;1
"light giant sponge next to brownish corals";16142;1DD5zvg_;11313;0
"giant fat sponge looking like pneumatic";16142;1DD5zvg_;177;0
"yellowish corals with grey octopus";16394;1DD5zvg_;4562;0
"yellowish smooth corals with grey hairy coral looking like octopus";16394;1DD5zvg_;3418;0
"giant black ray next to rock";16631;1DD5zvg_;456;1
"giant black manta ray next to rock";16631;1DD5zvg_;22;1
"a lot of small blue fishes with yellowish fins";16673;1DD5zvg_;97;1
"a lot of small blue fishes with yellowish fins, atlantic spadefish";16673;1DD5zvg_;43;1
"bush hairy coral on green and red rock";18547;1DD5zvg_;128;1
"bush hairy coral on green and red rock, caribbean reef octopus";18547;1DD5zvg_;21;1
"rocks in grey sand with dark blue fish";18677;1DD5zvg_;15118;0
"rock monument in grey sand with small dark blue fish";18677;1DD5zvg_;6011;0
"coral reef with small blue parrotfish";19807;1DD5zvg_;64;0
"coral reef with small blue parrotfish and brown sea cucumber";19807;1DD5zvg_;7;1
"mars surface";20426;1DD5zvg_;4;1
"scuba diver with flashlight";20912;1DD5zvg_;6;1
"kelp forest";21412;1DD5zvg_;8;1
"bright yellow fins of scuba diver in spotlight";21876;1DD5zvg_;22;1
"diver with yellow shirt";3604;EPt87JL1;4299;0
"diver with yellow shirt, yellow tube sponge";3604;EPt87JL1;4516;0
"cliff and yellow fish";4719;EPt87JL1;149;0
"cliff and yellow fish, banded butterflyfish, giant barrel sponge";4719;EPt87JL1;129;0
"fish on sand";91;EPt87JL1;495;0
"fish on sand, spotted porcupinefish, sarcastic fringehead";91;EPt87JL1;215;1
"purple coral";791;EPt87JL1;11;1
"shark on bottom";17862;EPt87JL1;1142;0
"whitetip reef shark cyan sand";17862;EPt87JL1;87;1
"moray eel open mouth";4022;EPt87JL1;4;1
"coral fins";811;EPt87JL1;29;1
"crab cage";1337;EPt87JL1;3;1
"fish with stripes";2819;EPt87JL1;134;1
"fish with stripes, queen angelfish";2819;EPt87JL1;39;1
"star";105;EPt87JL1;3428;0
"star, great star coral, sea star";105;EPt87JL1;18;1
"fish with stripes";193;EPt87JL1;177;1
"fish with stripes, kingfishes, clown triggerfish";193;EPt87JL1;77;0
"diver mask hair";317;EPt87JL1;10;1
"ship wreck steel blue";10759;EPt87JL1;541;1
"shipwreck, elkhorn coral";10759;EPt87JL1;2068;1
"ray";2742;EPt87JL1;1200;0
"ray, spotted eagle ray, giant manta ray, eagle ray";2742;EPt87JL1;220;0
"pink coral";1623;EPt87JL1;32;1
"coral fins";2951;EPt87JL1;3563;0
"coral fins, cockscomb cup coral, lettuce coral";2951;EPt87JL1;1168;0
"lettuce coral";2235;EPt87JL1;474;0
"lettuce coral, cockscomb cup coral and purple coral";2235;EPt87JL1;168;0
"sea floor coral fins";9828;EPt87JL1;4546;0
"sea floor coral fins, bamboo coral, stanghorn coral";9828;EPt87JL1;909;1
"diver blue fins";2295;EPt87JL1;11762;0
"diver blue fins, lookdown dory";2295;EPt87JL1;12816;0
"thorn fish";97;EPt87JL1;2006;0
"thorn fish, threespot damselfish, bluebanded goby";97;EPt87JL1;15285;0
"three divers";4314;EPt87JL1;78;0
"three divers, giant barrel sponge";4314;EPt87JL1;2935;0
"corals and fish";4646;EPt87JL1;3466;0
"corals and fish, honeycomb coral, stanghorn coral";4646;EPt87JL1;7276;0
"yellow fish lettuce coral";3053;EPt87JL1;43;1
"yellow corals";1419;EPt87JL1;38;1
"lot of fish bush coral";2486;EPt87JL1;1914;0
"lot of fish bush coral, cockscomb cup coral, kelp forest, branching cauliflower coral";2486;EPt87JL1;3583;0
"yellow fish reef";3951;EPt87JL1;373;0
"yellow fish reef, banded butterflyfish";3951;EPt87JL1;913;0
"sharks in deep sea";5541;EPt87JL1;37;1
"turtle";2809;EPt87JL1;187;0
"turtle, hawksbill turtle, loggerhead turtle";2809;EPt87JL1;4;1
"coral labyrinth";1851;EPt87JL1;631;0
"coral labyrinth, ivory bush coral";1851;EPt87JL1;12;1
"vertical fish clif";4481;EPt87JL1;212;1
"vertical fish clif, atlantic spadefish";4481;EPt87JL1;16;1
"lettuce coral diver";3415;EPt87JL1;1845;0
"lettuce coral diver, cockscomb cup coral, branching cauliflower coral";3415;EPt87JL1;4939;0
"greyish fish on sandy sea bottom";14096;test;54;1
"greyish fish on sandy sea bottom, atlantic trumpetfish, shovelnose spiny dogfish, lucifer dogfish";14096;test;386;0
"greyish stripped fish on a blue-grey sand";14096;test;428;1
"bluebanded goby, atlantic trumpetfish, bluebanded goby, inshore lizardfish";14096;test;342;1
"blue nose appearing from a hole";4022;test;14;1
"grey fish on a seabed";91;test;30;1
"blue fish with white dots on a coral";16545;test;704;1
"blue fish with white dots on a coral, queen parrotfish, parrotfish, blue spotted ribbontail ray";16545;test;18;1
"big coral with diver at back";3415;test;2111;1
"diver, pillar coral , threespot damselfish";3415;test;3963;0
"violette fish in front of rock with a hole";18677;test;2485;0
"violette fish in front of rock with a hole, broadclub cuttlefish, caribbean reef octopus, flatback turtle";18677;test;3709;0
"diver with yellow shoes";21876;test;41;1
"fish with blue background and boat trunk on top";16631;test;759;0
"fish with blue background and boat trunk on top, pelagic thresher shark, blue shark";16631;test;928;0
"big fish with sponge coral on the back";2785;test;81;0
"big fish with sponge coral on the back, gray triggerfish, clown triggerfish, atlantic spadefish";2785;test;59;1
"dart on a sand";18806;test;265;0
"dart on a sand, southern stingray, slender snipe eel, longnose sawshark, shortfin eel";18806;test;33;1
"tiger manta";8912;test;1130;1
"tiger manta, eagle ray, spotted eagle ray, tropical two-wing flyingfish";8912;test;80;1
"shark on bluish sand";17862;test;315;1
"shark on bluish sand, nurse shark, lemon shark, bull shark, spinner shark";17862;test;72;1
"underwatter trees";21412;test;15;1
"pink coral with a fish in the centre";9368;test;14530;0
"pink coral with a fish in the centre, rose coral";9368;test;14597;0
"squid with grey sand and coral";12906;test;1258;0
"squid with grey sand and coral, smooth mounding coral";12906;test;1173;0
"greyish sandish coral on bottom with fisha and blue watter behind";4646;test;2080;0
"greyish sandish coral on bottom with fisha and blue watter behind, nassau grouper, bamboo coral, boulder star coral";4646;test;1026;1
"pillar column with small fish";3053;test;507;0
" with small fish, pillar coral";3053;test;2;1
"brown-greyish mushroom on sand";14417;test;223;0
"brown-greyish mushroom on sand, smooth mounding coral, elkhorn coral, honeycomb coral";14417;test;701;0
"shark in blue ocean";5599;test;786;0
"shark in blue ocean, blue shark, shortfin mako shark, longfin mako shark";5599;test;89;1
"hairy pblue-green coral";6295;test;30;1
"shark in dark sea";5432;test;221;1
"shark in dark sea, bowhead whale, whale, greenland shark";5432;test;39;1
"yellow star on sand";13947;test;17;1
"pilar coral with greenish water";2235;test;153;0
"pilar coral with greenish water, cockscomb cup coral, boulder star coral, hood coral";2235;test;249;0
"murena fish on green-blueish sand and coral";5358;test;2545;0
"murena fish on green-blueish sand and coral, green moray eel, banded wrasse";5358;test;526;0
"stripped fish with diver on background";193;test;1110;0
"stripped fish with diver on background, atlantic spadefish, gray triggerfish, queen parrotfish";193;test;482;0
"diver face with blue-green sandy background";317;test;708;1
"holed coral brown-redish";14346;test;8105;1
"holed coral brown-redish, giant barrel sponge";14346;test;1505;1
"corals on right bottom with blue water on top";9104;test;10331;0
"corals on right bottom with blue water on top, smooth mounding coral, honeycomb coral, pillar coral";9104;test;6012;0
"black fish in front of a flock of horizontally striped fishes";426;test;15;1
"eel hairline corals closeup";18547;test;46;1
"yellow clustered corals";1419;test;206;1
"yellow clustered corals, mustard hill coral, kelp forest";1419;test;45;1
"brown-white crabish on bluish sand";5025;test;147;0
"brown-white crabish on bluish sand, southern stingray, sand flounder, greenback flounder";5025;test;1156;0
"manta on top of bluish rocky coral";2742;test;3741;0
"manta on top of bluish rocky coral, giant manta ray";2742;test;215;0
"underwatter bars and doors";10739;test;99;1
"underwatter bars and doors, shipwreck, mirror dory";10739;test;87;1
"yellow-reddish coral in the dark";21617;test;719;0
"yellow-reddish coral in the dark, venus sea fan coral";21617;test;338;0
"pilar coral lighted from sides in a dark ocean";12829;test;313;0
"pilar coral lighted from sides in a dark ocean, cockscomb cup coral";12829;test;293;1
"a flock of blak fishes swimming to the top";4481;test;76;1
"a flock of blak fishes swimming to the top, flashlight fish, atlantic spadefish";4481;test;15;1
"large greenish cloth on top of small sand rocks";646;test;31;1
"holed reddish coral in sea";15450;test;3279;0
"holed reddish coral in sea, smooth mounding coral";15450;test;1479;0
"wrinkled coral with small fish in the centre, watter is almost not visible";10123;test;7466;0
"wrinkled coral with small fish in the centre, watter is almost not visible, branching cauliflower coral";10123;test;7573;0
"coral bushes";9656;test;81;0
"coral bushes, smooth mounding coral";9656;test;63;1
"brown octopus";12785;test;24;1
"brown octopus on sand";12785;test;5;1
"three divers";4314;test;78;0
"three divers, smooth mounding coral";4314;test;1235;0
"brown-white fish on sand";12525;test;3;1
"fishes in front of a rock and blue water";4719;test;521;0
"fishes in front of a rock and blue water, atlantic spadefish, atlantic trumpetfish";4719;test;669;0
"coral bushes with blue water";9828;test;8546;0
"coral bushes with blue water, smooth mounding coral, stanghorn coral, bamboo coral";9828;test;4773;1
"red fish on top of greenish coral and sand";13333;test;41;1
"blue-yellow fish on top of sand and corals";9600;test;12;1
"atlantic trumpetfish";13333;test_n;14218;0
"nemo";13333;test_n;168;0
"brown coral";9828;test_n;3183;0
"brown coral, small fish in the background";9828;test_n;4709;0
"no coral, dark blue, group of fish";16673;test_n;1683;0
"no coral, dark blue, group of fish, blue mackerel";16673;test_n;748;0
"diver, fish";362;test_n;995;0
"diver, fish, pacific bluefin tuna";362;test_n;975;1
"one fish in the middle";2785;test_n;5422;0
"one fish in the middle, bluefin tuna";2785;test_n;1484;0
"small red fish";6114;test_n;59;1
"blue fish in the middle";4022;test_n;1207;0
"blue fish in the middle, clown triggerfish";4022;test_n;344;0
"two ray fish";8912;test_n;1513;1
"two ray fish, spotted eagle ray";8912;test_n;47;1
"black fish behind coral";4646;test_n;116;0
"black fish behind coral, atlantic spadefish";4646;test_n;175;0
"school of dark fish, coral on the left";4481;test_n;76;1
"school of dark fish, coral on the left, atlantic spadefish";4481;test_n;3;1
"sea mouse in the middle, coral";5358;test_n;2294;0
"sea mouse in the middle, coral, sea urchin";5358;test_n;2807;0
"ship wreck, dark sea";10739;test_n;887;1
"ship wreck, dark sea, shipwreck, trench";10739;test_n;145;1
"net, mesh, cage in the sea, coral";1337;test_n;3;1
"white fish with brown stripes, light on the left, sea, sand, dark on the right";12525;test_n;16;1
"sea, cactus, mushroom on the right, light";1851;test_n;312;0
"sea, cactus, mushroom on the right, light, pillar coral, smooth mounding coral, honeycomb coral";1851;test_n;53;1
"two dark fish in the middle, coral, dark on the right";2951;test_n;5349;0
"two dark fish in the middle, coral, dark on the right, threespot damselfish, atlantic spadefish";2951;test_n;8661;1
"nemo, red fish with white stripes, fish in the middle, sand, mushroom in the middle";6231;test_n;176;0
"nemo, red fish with white stripes, fish in the middle, sand, mushroom in the middle, clownfish, clown triggerfish";6231;test_n;82;0
"black fish in front, school of white stripped fish in the back";426;test_n;91;0
"black fish in front, school of white stripped fish in the back, skipjack tuna, bluefin tuna";426;test_n;1913;0
"hand, diver, watches, coral";13252;test_n;548;1
"hand, diver, watches, coral, giant clam";13252;test_n;16;1
"big dark fish, fish on the bottom, white dots";5282;test_n;1298;0
"big dark fish, fish on the bottom, white dots, whale shark";5282;test_n;66;1
"yellow starfish in the middle, sand";13947;test_n;7;1
"red coral in the middle";14346;test_n;4213;0
"red coral in the middle, red rice coral";14346;test_n;2276;0
"school of small black fish, coral, yellow in front";2549;test_n;11570;0
"school of small black fish, coral, yellow in front, banded butterflyfish, threespot damselfish, blue tang";2549;test_n;5328;0
"gray fish in the middle, dark sand";91;test_n;134;1
"gray fish in the middle, dark sand, sea perch, gag grouper";91;test_n;207;1
"shark shadow, dark blue sea";5541;test_n;98;1
"shark shadow, dark blue sea, oceanic whitetip shark, hammerhead shark, scalloped hammerhead shark";5541;test_n;16;1
"two divers, trees, wreck, sea";21412;test_n;23;1
"wreck, sea, ship, seven windows, gray fish";10759;test_n;9;1
"turtle with green back, brown coral";9772;test_n;168;0
"turtle with green back, brown coral, hawksbill turtle, green turtle, loggerhead turtle, sea turtle";9772;test_n;275;0
"white sharp fish in the middle, sand";97;test_n;17311;0
"white sharp fish in the middle, sand, striped mullet";97;test_n;20902;0
"two rays in the middle, dark sea, sand";8931;test_n;4993;0
"two rays in the middle, dark sea, sand, eagle ray, spotted eagle ray";8931;test_n;42;1
"blue fish with yellow, coral, black fish";9600;test_n;59;1
"two brown mushroom, trees, black background, light, coral";12829;test_n;1336;0
"two brown mushroom, trees, black background, light, coral, boulder star coral, pillar coral, smooth mounding coral";12829;test_n;91;0
"big gray fish in the middle, sand, coral";16545;test_n;1380;1
"big gray fish in the middle, sand, coral, queen parrotfish";16545;test_n;258;1
"five yellow fish, coral, dark, sea";3951;test_n;85;0
"five yellow fish, coral, yellowtail snapper";3951;test_n;579;0
"small orange fish in the middle, coral, dark";12906;test_n;5564;0
"small orange fish in the middle, coral, dark, vermilion snapper";12906;test_n;224;0
"orange fish with black dot, sea flower, sea mushroom";14417;test_n;106;0
"orange fish with black dot, sea flower, sea mushroom, clownfish";14417;test_n;276;0
"three rays, sand, coral";8740;test_n;3965;0
"three rays, sand, coral, blue spotted ribbontail ray, porcupine ray";8740;test_n;4;1
"yellow fish with white stripes, white black fishes, diver";193;test_n;169;0
"yellow fish with white stripes, white black fishes, diver, banded butterflyfish, banded butterflyfish, yellowtail snapper";193;test_n;168;0
"diver, snorkeling, pink coral, yellow coral, black fish";16062;test_n;3929;1
"diver, snorkeling, pink coral, yellow coral, black fish, yellow tube sponge, threespot damselfish";16062;test_n;2784;1
"white mushroom, reddish mushroom, coral, sponge";811;test_n;405;0
"white mushroom, reddish mushroom, coral, sponge, honeycomb coral, pillar coral";811;test_n;424;0
"one turtle in the middle, white dark, white coral";2809;test_n;108;1
"one turtle in the middle, white dark, white coral, hawksbill turtle, green turtle";2809;test_n;15;1
"yellow black fish, blue fish zellow stripes, red coral";2658;test_n;3;1
"gray mushroom, sponge, sea sand";791;test_n;208;0
"gray mushroom, sponge, sea sand, yellow tube sponge";791;test_n;246;0
"light fish with black dots, sand on the bottom, sea on the top";11643;test_n;149;1
"light fish with black dots, sand on the bottom, sea on the top, spotted porcupinefish, porcupine fish";11643;test_n;17;1
"orange octopus, sand";12785;test_n;41;1
"red coral, volcano in the middle, small fish in the background";15450;test_n;11280;0
"red coral, volcano in the middle, small fish in the background, pillar coral";15450;test_n;4513;0
"yellow coral, blue in the background, trees";1419;test_n;91;1
"yellow coral, blue in the background, trees, yellow tube sponge";1419;test_n;18;1
"school of sardines, blue on the left, dark sand on the right";4999;test_n;4135;0
"school of sardines, blue on the left, dark sand on the right, pacific sardine";4999;test_n;2094;0
"shark on the sand, sponge in the front";17862;test_n;966;0
"shark on the sand, sponge in the front, nurse shark, lemon shark";17862;test_n;74;1
"yellow grass coral";6295;test_n;14;1
"gray grass in sea";1623;test_n;6623;0
"gray grass in sea, seagrass bed, seagrass";1623;test_n;3669;0
"yellow fish on black sand";5104;test_n;9781;0
"yellow fish on black sand, orange perch";5104;test_n;3990;0
"stripped fish under coral";9487;test_n;3726;0
"stripped fish under coral, moorish idol, threespot damselfish";9487;test_n;3577;0